{"format":"llm-foundations-data-audit-v1","dataset_id":"22222222-2222-4222-8222-222222222222","eligibility":"audit_only","record_count":48,"utf8_bytes":1,"split_counts":{"train":24,"validation":12,"test":12},"slice_counts":{},"exact_duplicate_pairs":1,"normalized_near_duplicate_pairs":2,"group_overlap_count":1,"rejections":["cross-split leakage detected"],"checked_at":"2026-09-28T12:00:00.000Z","algorithm_version":"data-audit-v1"}
